{
  "inventoryId": "badcase-audit-assistant-overview",
  "title": "审核智能助手阶段汇报",
  "sourceType": "report",
  "facts": [
    {
      "id": "c1",
      "type": "conclusion",
      "text": "审核智能助手已形成稳定分析闭环，下一阶段重点转向统一口径与能力复用。",
      "importance": "critical"
    },
    {
      "id": "m1",
      "type": "evidence",
      "text": "五类核心分析能力已上线并稳定运行。",
      "importance": "high"
    },
    {
      "id": "m2",
      "type": "evidence",
      "text": "日均节省 3-4 小时人工分析时间。",
      "importance": "high"
    },
    {
      "id": "m3",
      "type": "evidence",
      "text": "关键问题平均响应时间小于 30 秒。",
      "importance": "high"
    },
    {
      "id": "m4",
      "type": "hierarchy",
      "text": "覆盖 5 个业务场景并保留 1 个扩展场景。",
      "importance": "high"
    },
    {
      "id": "h1",
      "type": "hierarchy",
      "text": "量级异常分析支持快速归因。",
      "importance": "high"
    },
    {
      "id": "h2",
      "type": "hierarchy",
      "text": "延时分析支持分钟级定位。",
      "importance": "high"
    },
    {
      "id": "h3",
      "type": "hierarchy",
      "text": "RR 调整分析支持空间回溯。",
      "importance": "medium"
    },
    {
      "id": "h4",
      "type": "hierarchy",
      "text": "任务池查询支持链路回溯。",
      "importance": "medium"
    },
    {
      "id": "h5",
      "type": "hierarchy",
      "text": "知识库问答支持持续补齐。",
      "importance": "medium"
    },
    {
      "id": "r1",
      "type": "risk",
      "text": "跨团队数据口径仍需统一。",
      "importance": "high"
    },
    {
      "id": "r2",
      "type": "risk",
      "text": "权限边界需要持续验证。",
      "importance": "medium"
    },
    {
      "id": "a1",
      "type": "action",
      "text": "补齐统一指标字典并固定双周复盘。",
      "importance": "high"
    },
    {
      "id": "a2",
      "type": "action",
      "text": "将稳定能力沉淀为可复用 Skill。",
      "importance": "high"
    }
  ],
  "sourceRef": "fixture:badcase-audit-assistant-overview"
}
