{
  "inventoryId": "official-product-claude4",
  "title": "Claude 4 与 Claude Code 能力介绍",
  "sourceType": "report",
  "facts": [
    {
      "id": "c1",
      "type": "conclusion",
      "text": "Claude 4 面向编码、复杂推理和长时间 Agent 工作流升级能力",
      "importance": "critical"
    },
    {
      "id": "h1",
      "type": "comparison",
      "text": "Opus 4 强调编码、复杂推理和长时间 Agent 任务",
      "importance": "high"
    },
    {
      "id": "h2",
      "type": "comparison",
      "text": "Sonnet 4 强调效率、可控成本和日常高频使用",
      "importance": "high"
    },
    {
      "id": "h3",
      "type": "hierarchy",
      "text": "Claude Code 支持 IDE 集成、后台任务和 SDK",
      "importance": "high"
    },
    {
      "id": "e1",
      "type": "evidence",
      "text": "本地文件访问可帮助模型提取并保存关键事实以维持连续性",
      "importance": "medium"
    },
    {
      "id": "r1",
      "type": "risk",
      "text": "长时间自主任务仍需测试、审查和权限约束",
      "importance": "high"
    }
  ],
  "sourceRef": "fixture:official-product-claude4"
}
