{
  "inventoryId": "official-product-chatgpt-agent",
  "title": "ChatGPT Agent 产品能力介绍",
  "sourceType": "report",
  "facts": [
    {
      "id": "c1",
      "type": "conclusion",
      "text": "ChatGPT Agent 将研究、浏览和行动能力整合进统一任务体验",
      "importance": "critical"
    },
    {
      "id": "h1",
      "type": "hierarchy",
      "text": "理解目标并规划多步骤任务",
      "importance": "high"
    },
    {
      "id": "h2",
      "type": "hierarchy",
      "text": "在计算机环境中浏览网站并使用工具",
      "importance": "high"
    },
    {
      "id": "h3",
      "type": "hierarchy",
      "text": "整合研究结果并交付可用产物",
      "importance": "high"
    },
    {
      "id": "p1",
      "type": "process",
      "text": "用户提出目标后 Agent 选择工具、执行并请求必要确认",
      "importance": "high"
    },
    {
      "id": "r1",
      "type": "risk",
      "text": "复杂网页操作和新型安全风险仍可能限制可靠性",
      "importance": "high"
    }
  ],
  "sourceRef": "fixture:official-product-chatgpt-agent"
}
