{
  "inventoryId": "stress-conflicting-benchmarks",
  "title": "模型能力材料中的冲突证据与选型判断",
  "sourceType": "mixed",
  "facts": [
    {
      "id": "q1",
      "type": "context",
      "text": "多个评测指标方向不一致时如何选择适合真实工作的模型",
      "importance": "critical"
    },
    {
      "id": "e1",
      "type": "evidence",
      "text": "复杂推理和编码评测显示推理模型优势明显",
      "importance": "high"
    },
    {
      "id": "e2",
      "type": "evidence",
      "text": "高吞吐日常任务仍更重视速度与成本",
      "importance": "high"
    },
    {
      "id": "o1",
      "type": "comparison",
      "text": "统一路由与固定模型各有可控性和效率取舍",
      "importance": "high"
    },
    {
      "id": "r1",
      "type": "risk",
      "text": "单一公开基准不能代表企业真实任务质量",
      "importance": "high"
    },
    {
      "id": "c1",
      "type": "conclusion",
      "text": "应使用真实任务集验证后再确定模型与路由策略",
      "importance": "high"
    }
  ],
  "sourceRef": "fixture:stress-conflicting-benchmarks"
}
